3つとも寒中でも美しいことから「歳寒三友」とも呼ばれ、宝酒造の日本酒の銘柄にも使われている、めでたいものとして慶事に使われる植物3つをまとめて何と呼ぶでしょう？,松竹梅,666
2008年にベイスターズ、2011年にホークスで首位打者を獲得し、日本プロ野球史上2人目となるセ・パ両リーグで首位打者となった選手は誰でしょう？,内川聖一,6666
手塚治虫の漫画『ブラック・ジャック』で、体がバラバラになった幼きブラック・ジャックを救った医師は誰でしょう？,本間丈太郎,66666
太陽系外縁天体探査機ニュー・ホライズンズには彼の遺灰が積まれている、1930年に冥王星を発見したアメリカの天文学者は誰でしょう？,クライド・トンボー,444444444
株式会社オモロキが2008年9月にサービスを開始した、写真などをお題として、それにボケをつけて楽しむオンラインサービスは何でしょう？,ボケて,443
元々はガラスなどを寄せ合わせた装飾手法のことで、転じて映像や写真などで被写体をそのまま見せないようにする加工のことを何というでしょう？,モザイク,4444
類体論の確立に貢献し、第1回フィールズ賞選考委員も務めた、『解析概論』『初等整数論講義』などの数学教科書を著した日本の数学者は誰でしょう？,高木貞治,6666
アポロ14号の船長アラン・シェパードが月面で行ったスポーツは何でしょう？,ゴルフ,444
「バーツ」を通貨とする国はタイですが、「バツ」を通貨とするオセアニアの国はどこでしょう？,バヌアツ共和国,4444666
1957年のソビエト連邦によるスプートニク1号の打ち上げに対抗する形で開発された、アメリカ初の人工衛星は何でしょう？,エクスプローラー1号,4444444406
東アジアと東南アジアの広範な地域で古くから食されている、大豆の絞り汁を凝固剤で固めた加工食品は何でしょう？,豆腐,66
英語では「りんごを磨く」などと表現する、人に気に入られようとする様を表す慣用句を日本語では「何をする」というでしょう？,ごまをする,33333
カクテルのジン・バックやバーボン・バックを作る際に、レモンまたはライムのジュースとともに加えられる炭酸飲料は何でしょう？,ジンジャーエール,44444444
フランス語の「切り取る」という言葉から生まれた、日本では特にチラシに付いている割引券など、客が何らかの特典を得られる商材を指す言葉は何でしょう？,クーポン,4444
昭和天皇のいとこにあたる鳥類学者で、紀宮清子内親王が勤めていた鳥類研究所に名前を残す人物は誰でしょう？,山階芳麿,6666
バーテンダーの島村が爆弾事件の真相を究明する姿を描いた、史上初となる江戸川乱歩賞と直木賞のダブル受賞を果たした藤原伊織の小説は何でしょう？,テロリストのパラソル,4444434444
ロシア語で「黒い土」という意味がある、ウクライナからロシアにかけて分布する黒い土壌を何というでしょう？,チェルノーゼム,4444444
元々は、馬を降りる場所で主人を待つ間にお供の者同士が交した評判のことで、現在では一般の人の政治批評や世間の評判を指す言葉は何でしょう？,下馬評,666
映画『男はつらいよ』シリーズの主人公・寅さんのフルネームは何でしょう？,車寅次郎,6666
1924年に完成し、その年の十干十二支が名前の由来となっている、高校野球の試合や阪神タイガースの本拠地で知られるのは何球場でしょう？,阪神甲子園球場,6666666
元々は造幣局として作られたため「お金」という意味を持つ、チリの大統領官邸として使われている宮殿の名前は何でしょう？,モネダ宮殿,44466
日本で最も面積が大きい平野は何平野でしょう？,関東平野,6666
その背番号「42」はメジャーリーグ全球団共通の永久欠番となっており、メジャーリーグの新人王に与えられる賞の別名にもなっている、一般的に「黒人初のメジャーリーガー」といわれる元選手は誰でしょう？,ジャッキー・ロビンソン,44444444444
一般に「大学いも」「やきいも」といえば何という芋で作られる料理でしょう？,サツマイモ,44444
別名を「鶯菜」という野菜で、その名前は、江戸時代に現在の東京都江戸川区小松川付近で多く栽培されたことにちなむ、アブラナ科の野菜は何でしょう？,小松菜,666
現在の形態のものは1946年に埼玉県蕨町で行われた「青年祭」が起源とされる、一般に1月の第2月曜日に行われる20歳を迎えた人々を祝うイベントは何でしょう？,成人式,666
NHKの『おかあさんといっしょ』では2代目うたのおにいさんを務めていた人物で、『マジンガーZ』『バビル2世』のオープニング曲を歌っている「アニメソングの帝王」の異名を持つ人物は誰でしょう？,水木一郎,6666
論理学で多大な業績を残したものの、晩年は精神を病み、栄養失調で亡くなったとされる、不完全性定理の証明を行なった数学者は誰でしょう？,クルト・ゲーデル,44444444
一般に単に「凱旋門」と呼ばれることが多い、フランス・パリのシャルル・ド・ゴール広場にある建造物を、広場の旧称をとって正式には「何凱旋門」というでしょう？,エトワール凱旋門,44444666
遊園地にある「メリーゴーラウンド」を日本語では漢字4文字で何というでしょう？,回転木馬,6666
韓国では「チョナン・カン」という芸名を用いている、テレビドラマ『任侠ヘルパー』や『僕の生きる道』などで主演を務めた元SMAPのメンバーは誰でしょう？,草彅剛,666
日本プロ野球で、監督として通算1，773勝という史上最多記録を持つ、「グラウンドにはゼニが落ちている」という言葉でも知られる人物は誰でしょう？,鶴岡一人,6666
イタリア国旗の三色をイメージし、地中海のシチリア島にちなんで命名された、佐賀市のB級グルメは何でしょう？,シシリアンライス,44444444
オリエンタルランドの筆頭株主でもある、千葉中央駅とちはら台駅を結ぶ千原線や、上野駅と成田空港駅を結ぶ本線などを保有する鉄道会社は何でしょう？,京成電鉄,6666
1967年に日本初の自動改札機が設置された、大阪府にある阪急電鉄の駅はどこでしょう？,北千里駅,6666
かつては「カネコ」という芸名を用いていた、ツッコミの安藤なつとともにお笑いコンビ「メイプル超合金」を組んでいる、真っ赤な服装に金髪がトレードマークのお笑い芸人は誰でしょう？,カズレーザー,444444
漢字で「凹む」と書けば「へこむ」と読みますが、「凸む」と書けば何と読むでしょう？,つばくむ,3333
代表曲に『TOKIO』や『勝手にしやがれ』がある、「ジュリー」の愛称で親しまれている歌手は誰でしょう？,沢田研二,6666
日本の国立大学で経営学部を設置している2つの大学とは、神戸大学と何大学でしょう？,横浜国立大学,666666
2019年度を最後に廃止される、国立大学の一般入試受験者が原則的に受けなければならない試験を一般に何というでしょう？,センター試験,444466
キャッチフレーズは「King of 学芸会」である、2012年にシングル『仮契約のシンデレラ』でメジャーデビューしたスターダストプロモーション所属のアイドルグループは何でしょう？,私立恵比寿中学,6666666
プロ野球でこれまでに沢村賞を3回受賞したことのある投手は、杉下茂、金田正一、村山実とあと1人は誰でしょう？,斎藤雅樹,6666
コップの高さ以上に水が入る現象の原因となる、液体が表面積をできるだけ小さくしようとする時に働く力は何でしょう？,表面張力,6666
本名を平岡公威という、代表作に『豊饒の海』『金閣寺』などがある日本の作家は誰でしょう？,三島由紀夫,66666
動物の肉の異名で、猪肉は「牡丹」、馬肉は「桜」ですが、鹿の肉は何というでしょう？,紅葉,66
1658年にチェコの教育者コメニウスによって著された、世界初の絵本ともいわれる子供向けの教科書は何でしょう？,世界図絵,6666
密度の異なる大気の中で光が屈折することで起こる景色が浮き上がって見えたり、逆さに見えたりする現象は何でしょう？,蜃気楼,666
2009年に「単独のアニメーションシリーズでのキャラクター数」がギネス世界記録に認定された、やなせたかし原作のテレビアニメのタイトルは何でしょう？,それいけ!アンパンマン,33335444444
東北地方などで夏の始め頃に吹く、冷害の原因になる冷たい風を何というでしょう？,やませ,333
現在の単位「ヘクトパスカル」に変更されるまで、日本の天気予報で使われていた気圧の単位は何でしょう？,ミリバール,44444
1956年に運行開始し、東京駅と博多駅を結んでいた、日本における第二次世界大戦後初の夜行特急の愛称は何でしょう？,あさかぜ,3333
日本の元号が平成になった時の内閣総理大臣は誰だったでしょう？,竹下登,666
2007年のドラマ版放送時には「華麗ぱん」というコラボ商品も発売された、関西の財界に君臨する銀行頭取一族の策謀と親子の確執を描いた山崎豊子による小説といえば何でしょう？,華麗なる一族,663366
アイヌ語で「魚の住まない川」もしくは「片割れの川」を意味する言葉がその語源だとされる、北海道由仁町を流れる一級河川は何川でしょう？,ヤリキレナイ川,4444446
「なぜ めぐり逢うのかを 私たちは なにも知らない」という歌い出しで始まる、Bank Bandや福山雅治もカバーしている中島みゆきの曲は何でしょう？,糸,6
日本では東京と名古屋にある、ジャズやブルースに用いられる音階が店名になっている、1981年にニューヨークで開業したジャズ・クラブは何でしょう？,ブルーノート,444444
イヌノフグリなど2，500種以上の植物を命名した「日本植物学の父」と呼ばれた高知県出身の植物学者は誰でしょう？,牧野富太郎,66666
ローマ神話に登場する軍神「マルス」をシンボルマークとする、ドイツに本社を置く文房具メーカーは何でしょう？,ステッドラー,444444
「ダニエル・K・イノウエ国際空港」があるハワイ・オアフ島にある都市はどこでしょう？,ホノルル,4444
日本人の三宅精一が考案者である、大きく「誘導」と「警告」の2種類に分けられ、視覚障がい者を誘導するために地面などに敷設されるプレートを一般に何というでしょう？,点字ブロック,664444
中国湖南省にある世界遺産で、珪岩でできた巨大な石柱が立ち並ぶ風景が特徴的な自然保護区といえば何でしょう？,武陵源,666
NASAの宇宙センターで歴代アメリカ大統領の名前が付いているのは「ケネディ宇宙センター」と「何宇宙センター」でしょう？,ジョンソン宇宙センター,44444664444
慣用句で、淀みなく話すことを「立て板に水」といいますが、不意の出来事に驚くことを「何に水」というでしょう？,寝耳に水,6636
ドボルザークの交響曲『新世界より』の「新世界」とは、どこの国のことでしょう？,アメリカ,4444
日本語では「経営学修士」と訳される、アメリカのビジネススクールで授与される学位をアルファベット3文字で何というでしょう？,MBA,222
都道府県立自然公園が1件も指定されていない唯一の都道府県はどこでしょう？,群馬県,666
食材に海苔を巻いたり、衣に海苔をまぶしたりして油で揚げた料理を一般に何というでしょう？,磯辺揚げ,6663
映画『暗黒街の顔役』や『アンタッチャブル』など、彼をモデルとしたギャング作品が数多く作られていることで知られる、禁酒法時代のアメリカ・シカゴで暗躍した実在のイタリア系ギャングは誰でしょう？,アル・カポネ,444444
赤貝やイカなどに格子状の切り込みを入れる刺身の調理法のことを、その切れ目が子鹿の模様に似ていることから何造りというでしょう？,鹿の子造り,63663
『沙羅曼蛇』などの続編がある、いわゆる「コナミコマンド」を初めて搭載したファミコンソフトは何でしょう？,グラディウス,444444
セガのゲームキャラクター、ソニック・ザ・ヘッジホッグは何の動物を擬人化したキャラクターでしょう？,ハリネズミ,44444
父にスウェーデン第15代首相を務めたヤルマルを持つ、第2代国際連合事務総長の在任中に飛行機事故により亡くなったスウェーデンの政治家は誰でしょう？,ダグ・ハマーショルド,4444444444
白米の中央に梅干しを配置して日本の国旗を表現した弁当のことを一般に「何弁当」というでしょう？,日の丸弁当,63666
州都はシャーロットタウンである、カナダのセントローレンス湾に浮かぶ島にある州で、カナダの州では面積・人口ともに最下位であるものの、モンゴメリの小説『赤毛のアン』の舞台として有名なのは何州でしょう？,プリンス・エドワード・アイランド州,44444444444444446
その商品名は物事の始まりを表す言葉と健康で持続可能な生活様式を意味する言葉を組み合わせたものである、日本コカ・コーラが販売するナチュラルミネラルウォーターのブランド名は何でしょう？,い・ろ・は・す,3434343
全高828m、206階建ての、アラブ首長国連邦・ドバイにある世界一高い超高層ビルは何でしょう？,ブルジュ・ハリファ,444444444
代表作に『我々はどこから来たのか 我々は何者か 我々はどこへ行くのか』という絵画がある、フランスのポスト印象派の画家は誰でしょう？,ポール・ゴーギャン,444444444
カリブ海の島国で、「シエンフエーゴスの都市的歴史地区」「ビニャーレス渓谷」「ハバナ旧市街とその要塞群」といったユネスコの世界遺産があるのはどこでしょう？,キューバ共和国,4444666
第二次世界大戦の終結は昭和でいうと何年でしょう？,昭和20年,66006
ユネスコの世界遺産であるアンコール・ワット遺跡が国旗にデザインされているアジアの国といえばどこでしょう？,カンボジア王国,4444466
弟に同じく政治家のオーギュスタンがいる、18世紀のフランスにおいて、公安委員会の長として恐怖政治を行ったとされるジャコバン派の政治家は誰でしょう？,マクシミリアン・ロベスピエール,444444444444444
1840年から2年間にわたり行われたイギリスと清の戦争を、原因となった薬物から「何戦争」というでしょう？,アヘン戦争,44466
日本で最初にノーベル賞を受賞した人物は誰でしょう？,湯川秀樹,6666
ローマを州都としているイタリアの州は何州でしょう？,ラツィオ州,44446
アルバニアの国旗に描かれている2つの頭を持つ鷲のことを、オスマン帝国に抵抗した英雄の名をとって「何の鷲」というでしょう？,スカンデルベグの鷲,444444436
ロシア、ノルウェー、スウェーデン、フィンランド、エストニア、ラトビア、リトアニア、ウクライナ、ベラルーシ、モルドバの10ヶ国にまたがる世界遺産は「何の測地弧」でしょう？,シュトルーヴェの測地弧,44444443666
ヒット曲『上を向いて歩こう』の作詞・作曲・歌唱をそれぞれ担当した永六輔・中村八大・坂本九の3人は、それぞれの名前から「何トリオ」と呼ばれていたでしょう？,六八九トリオ,666444
日本において、コンサート用の木琴を「シロフォン」と呼びますが、コンサート用の鉄琴をドイツ語で何と呼ぶでしょう？,グロッケンシュピール,4444444444
低予算で個人旅行をする人のことを、その人たちがよく持っているカバンの名前から何と呼ぶでしょう？,バックパッカー,4444444
日本野鳥の会の初代会長を務めた「野鳥の父」と呼ばれる人物で、「野鳥」や「探鳥」という言葉を生み出したことで知られるのは誰でしょう？,中西悟堂,6666
恋愛が成就しないことを「失恋」というのに対し、恋愛が成就することを2字熟語で何というでしょう？,得恋,66
1987年に『テレビの中に』でデビューした、代表曲に『愛は勝つ』がある日本のシンガーソングライターは誰でしょう？,KAN,222
1980年に『ローレライ』でデビューした、テレビアニメ『みゆき』のエンディング曲に起用され大ヒットした楽曲『想い出がいっぱい』で知られる日本の男性デュオは何でしょう？,H2O,202
一般的な12星座占いで、1月生まれの人が該当する可能性のある2つの星座とは、山羊座と何でしょう？,水瓶座,666
亡くなった人の魂が楽園に行くまでの過程をヒエログリフと絵で表している、古代エジプトで埋葬の際に用いられた文書を何というでしょう？,死者の書,6636
テレビドラマや映画などで、原作者や政治家などの著名人がわずかな時間だけゲスト出演することを、ある装飾品の名前を使って何出演というでしょう？,カメオ出演,44466
三松正夫による「ミマツダイヤグラム」という世界で唯一の火山の誕生記録が残っている、北海道にある活火山は何でしょう？,昭和新山,6666
夏の全国高校野球選手権大会で1大会の最多奪三振記録を記録した、徳島商業高校出身の元プロ野球選手は誰でしょう？,板東英二,6666
元々はビーバーの毛皮を用いて作られた、モーニングコート着用時に被る、つばの付いた円筒状の紳士帽子を何というでしょう？,シルクハット,444444
その名前の由来は、ローマを経由して西洋に伝わったためとされる、硬い葉脈と長細い丈夫な葉を持つレタスの品種は何でしょう？,ロメインレタス,4444444
素数の中で、唯一偶数である数は何でしょう？,2,0
穀物メジャーなどのように農作物に関する経済活動のことを、「農業」を意味する英単語から何ビジネスというでしょう？,アグリビジネス,4444444
ウラン鉱石から取り出されたウランを精練した物質を、その色合いから何というでしょう？,イエローケーキ,4444444
A環、B環、C環などの環を持ち、唯一比重が1.0を下回る太陽系の惑星といえば何でしょう？,土星,66
一般的に、日本の郵便ポストの色は赤色ですが、中国の郵便ポストの色は何色でしょう？,緑,6
「赤い英雄」という意味の名を持つ、現在のモンゴルの首都はどこでしょう？,ウランバートル,4444444
2005年には千葉ロッテマリーンズの監督としてチームを日本一に導き、同年に正力松太郎賞を受賞している、アメリカの元野球選手は誰でしょう？,ボビー・バレンタイン,4444444444
ドイツ語では「魔女の一撃」、正式には「急性腰痛症」という疾患で、重いものを持ち上げた時などに突然腰部に痛みが起こるものを何というでしょう？,ぎっくり腰,33336
「LaLaLa LaLaLa Zingen Zingen Kleine Vlinders」というフラマン語による歌い出しが特徴の、大杉久美子が歌うアニメ『フランダースの犬』のオープニング曲は何でしょう？,よあけのみち,333333
JR東海のキャンペーン「そうだ 京都、行こう。」のCM曲としても知られる、ミュージカル『サウンド・オブ・ミュージック』の劇中歌の邦題は何でしょう？,私のお気に入り,6336363
中居正広がプロデュースしている、アイドルグループKis-My-Ft2のメンバーのうち横尾渉・宮田俊哉・二階堂高嗣・千賀健永の4人で結成された派生ユニットは何でしょう？,舞祭組,666
サッカーワールドカップの主催団体「国際サッカー連盟」を、アルファベット4文字の略称で何というでしょう？,FIFA,2222
「ソジャーナ」「スピリット」「オポチュニティ」「キュリオシティ」といえば、何という天体の探査車でしょう？,火星,66
炎色反応で黄色を呈し、医薬や栄養の分野においてはソジウムとも呼ばれる、食塩にも含まれる元素は何でしょう？,ナトリウム,44444
ワールドカップ通算86勝という最多記録を持つスウェーデンのアルペンスキー選手で、ライバルたちに「彼に次ぐ2位は優勝と同じ価値がある」と言わしめた人物は誰でしょう？,インゲマル・ステンマルク,444444444444
ヤナギ科の植物を分類したことや、原始的なクモとして有名な「キムラグモ」を発見したことで知られる日本の植物学者は誰でしょう？,木村有香,6666
ビートルズの楽曲名にも使われている、英語で「ソビエト社会主義共和国連邦」を意味するアルファベット4文字は何でしょう？,USSR,2222
絵本作家エリック・カールが1969年に出版した、あおむしが色々なものを食べて大きくなりやがて美しい蝶となっていくという内容の絵本は何でしょう？,はらぺこあおむし,33333333
群論の「シローの定理」に名を残すルートヴィヒ・シロー、「リー群」に名を残すソフス・リー、「アーベル群」に名を残すニールス・アーベルはいずれもどこの国の数学者でしょう？,ノルウェー,44444
日本中央競馬の平地GIレースの中で、最長距離である天皇賞（春）の施行距離は何mでしょう？,3，200m,050001
アイヌ語で「大きい山」という意味がある、標高2，052mの日高山脈最高峰である山で、日本百名山に数えられる山の中で唯一読みが半濁音で始まるのは何でしょう？,幌尻岳,666
飼い主はスターリング・ノースという少年である、日本では1977年放映のアニメで知られるアライグマの名前は何でしょう？,ラスカル,4444
ボカロPユニット「学生気分」や、「ジェニーハイ」のギター、「indigo la End」と「ゲスの極み乙女。」のボーカル・ギターなどとして活躍する長崎県出身のミュージシャンは誰でしょう？,川谷絵音,6666
寒い時期に血流が滞ることによって手足の末端で起きやすい炎症を、空気中の水蒸気が昇華して物体の表面にできる氷の名前から何というでしょう？,しもやけ,3333
2005年に最優秀防御率・最多奪三振のタイトルを獲得したほか、リーゼントの髪型から「ハマの番長」の愛称で親しまれたことでも知られる、元プロ野球・横浜DeNAベイスターズの投手は誰でしょう？,三浦大輔,6666
つまようじの生産量日本一を誇る大阪府の市はどこでしょう？,河内長野市,66666
1957年のハリウッド映画『サヨナラ』で東洋人の俳優として初のアカデミー賞を受賞した、日本のジャズ歌手・女優は誰でしょう？,ナンシー梅木,444466
日本語では「星群」ともいう、北斗七星や夏の大三角などのように、恒星が形作る星座以外の図形のことを英語で何というでしょう？,アステリズム,444444
電流の流れる回路の周辺に生じる磁場の計算に用いられる、1820年に2人のフランス人物理学者が発見した電磁気学上の法則を、その2人の名をとって「何の法則」というでしょう？,ビオ・サバールの法則,4444444366
英語では「platelet」と呼ばれる、血液に含まれる止血作用を持つ成分の名前は何でしょう？,血小板,666
『マノン・レスコー』『ラ・ボエーム』『蝶々夫人』などのオペラ作品で知られる、イタリアの作曲家は誰でしょう？,ジャコモ・プッチーニ,4444444444
