一般的な88鍵のピアノの鍵盤で、最も高いのはドの音ですが、最も低いのは何の音でしょう？,ラ,4
相手が掴んだ白石の数が奇数か偶数かを当てる、囲碁の互先の対局で先手と後手を決める方法を何というでしょう？,ニギリ,444
将棋で、5枚の歩を投げて表裏の枚数により先手・後手を決める方法を何というでしょう？,振り駒,636
日本家屋の押入れの上に設けられている収納スペースを一般に何というでしょう？,天袋,66
囲碁の対局で、コミ以外のハンデキャップのない手合割のことを、かつて複数回の対局を行う際に先手と後手を交互に持っていたことに由来する言葉で何というでしょう？,互先,66
「芋づる式」という時の「芋」とは、どんな種類の芋を指しているでしょう？,サツマイモ,44444
アメリカンフットボールで、クォーターバックがパスを投げられなくなった場合に、自らボールを持って前進を図ることを何というでしょう？,スクランブル,444444
大塚製薬が販売し、大豆粉を使用したグルテンフリーの菓子となっている、ブルーベリーやアーモンド&チョコレートなどの種類がある商品は何でしょう？,SOYJOY,222222
人体において、胆汁の生成を行う臓器はどこでしょう？,肝臓,66
ビー玉を転がすための溝や穴がついた木製のブロックを組み合わせて、ビー玉が下まで転がる道を作って遊ぶ、プロ棋士の藤井聡太が幼少期に遊んでいたものとして一時期注目されたスイス発祥の玩具は何でしょう？,キュボロ,4444
アメリカの首都が現在のワシントンD.C.に移される直前の1800年まで同国の首都であった、ペンシルベニア州最大の都市といえばどこでしょう？,フィラデルフィア,44444444
社交ダンスで、左回りのステップを「リバース・ターン」というのに対し、右回りのステップを「何・ターン」というでしょう？,ナチュラル・ターン,444444444
ドラマ『あまちゃん』の成田りな役、アニメ『がっこうぐらし！』の丈槍由紀役、『ご注文はうさぎですか？』の香風智乃役などで知られる女優・声優は誰でしょう？,水瀬いのり,66333
東南アジアに生息する、現存する世界最大のセミは何でしょう？,テイオウゼミ,444444
ガードレールの端の丸まった部分を何というでしょう？,袖ビーム,6444
視力検査で使われるアルファベットのC字型のマークのことを、考案したスイスの眼科医の名前を取って何環というでしょう？,ランドルト環,444446
パズルゲーム『テトリス』で、上から落ちてくる4つの正方形で構成されたブロックのことを何というでしょう？,テトリミノ,44444
新品の靴下をまとめるために付いている金具のことを、ソックスとコンパスを合わせた造語で何というでしょう？,ソッパス,4444
2016年にノーベル文学賞を歌手として初めて受賞した、『ライク・ア・ローリング・ストーン』『風に吹かれて』などの曲で知られるアメリカのフォーク・ロック歌手といえば誰でしょう？,ボブ・ディラン,4444444
イスラエルの初代首相を務めた政治家の名前が付けられた、「世界一警備が厳しい空港」として知られる同国にある国際空港は何でしょう？,ベン・グリオン国際空港,44444446666
桁違いに大きい様を表す「超ド級」の「ド」とは、イギリスで建造された何という名前の戦艦の頭文字をとったものでしょう？,ドレッドノート,4444444
縦軸に税収、横軸に税率をとり、一定の税率を越えると逆に税収が減るということを示した曲線を、これを提唱したアメリカの経済学者の名前をとって何曲線というでしょう？,ラッファー曲線,4444466
別名を「クライモグラフ」といい、ケッペンの気候区分などに使われる、縦軸に気温、横軸に降水量をとって各月の値を順に結ぶグラフを、「水」と「熱」を意味するギリシャ語の接頭辞を組み合わせた言葉で何グラフというでしょう？,ハイサーグラフ,4444444
縦軸に絶対等級、横軸にスペクトル型を表した恒星の分布図を、これを提唱したデンマークとアメリカの天文学者の名前をとって何図というでしょう？,ヘルツシュプルング・ラッセル図,444444444444446
縦軸に賃金上昇率、横軸に失業率をとり、その関係を示した曲線を、これを提唱したイギリスの経済学者の名前をとって何曲線というでしょう？,フィリップス曲線,44444466
縦軸に死亡率、横軸に心停止・呼吸停止・大量出血の経過時間を取り、その関係を示したグラフのことを、これを1981年に報告したフランスの医師の名前を取って「何の救命曲線」というでしょう？,カーラーの救命曲線,444436666
「ここに地終わり海始まる」と刻まれた石碑が立つ、ポルトガルにあるユーラシア大陸最西端の岬は何岬でしょう？,ロカ岬,446
情報量の単位「1バイト」は、一般的に何ビットでしょう？,8ビット,0444
チベット語で「偉大な雪の5つの宝庫」という意味がある、エベレスト、K2に次いで世界で3番目に高い山は何でしょう？,カンチェンジュンガ,444444444
アメリカのケネディ大統領暗殺事件の真相究明を目的に作られた調査委員会を、その委員長で当時アメリカ最高裁判所長官だった人物の名をとって通称何委員会というでしょう？,ウォーレン委員会,44444666
屋根裏で暮らす貧しい画家に、月が33夜にわたって夜ごと様々な話を聞かせるという構成で書かれた、アンデルセンの連作短編集は何でしょう？,絵のない絵本,633366
中国語で長兄と次兄を意味する言葉に由来する、実力が接近していて優劣がないことをいう漢字2字の熟語は何でしょう？,伯仲,66
政治などで、強硬派を「タカ派」というのに対し、穏健派のことをある鳥の名を使って何派というでしょう？,ハト派,446
政治などで、穏健派を「ハト派」というのに対し、強硬派のことをある鳥の名を使って何派というでしょう？,タカ派,446
12～13世紀ごろのイタリアで神聖ローマ皇帝を支持した都市や貴族のことを、対立するローマ教皇を支持した「ゲルフ」に対して何と呼んだでしょう？,ギベリン,4444
12～13世紀ごろのイタリアでローマ教皇を支持した都市や貴族のことを、対立する神聖ローマ皇帝を支持した「ギベリン」に対して何と呼んだでしょう？,ゲルフ,444
子供への愛情で夫婦仲がつなぎとめられている様子を、ある大工道具に例えて「子は何」というでしょう？,鎹,6
丸く磨き上げられたものは「カーバンクル」と呼ばれる、「柘榴石」の別名を持つ1月の誕生石は何でしょう？,ガーネット,44444
この値が小さいほどボールを遠くへ飛ばすことができる、ゴルフクラブにおけるフェースの傾斜角度のことを何というでしょう？,ロフト,444
慣用句で、じわじわと痛めつけたり遠回しに責めたりすることを、ある繊維製品を使って「何で首を締める」というでしょう？,真綿で首を締める,66363633
その名はアラビア語で「砂漠」を意味する、アフリカ大陸北部に広がる世界最大級の砂漠を何砂漠というでしょう？,サハラ砂漠,44466
元々は「石灰」という字が当てられていた、消石灰に糸くずや糊を混ぜて作る、瓦の接着や壁の上塗りなどに使われる建材のことを現在一般に何というでしょう？,漆喰,66
農作業が比較的ひまである時期のことを、「農繁期」に対して何期というでしょう？,農閑期,666
農作業が比較的忙しい時期のことを、「農閑期」に対して何期というでしょう？,農繁期,666
ヘーゲルの弁証法の中で、テーゼとアンチテーゼからジンテーゼを導くための、日本語では「止揚」とされる言葉は何でしょう？,アウフヘーベン,4444444
将棋で穴熊囲いを完成させた時、王将の1つ前のマスにある駒は何でしょう？,香車,66
紀元前4世紀に、円錐の体積が同じ半径・高さの円柱の体積の3分の1であることを初めて証明したとされる、古代ギリシャの学者は誰でしょう？,エウドクソス,444444
英語で、「firefly」はホタルのことですが、「dragonfly」は何という昆虫のことでしょう？,トンボ,444
イスラム教の「サラート」と呼ばれる礼拝のうち、1日の最初に行われる夜明け前の礼拝のことを何というでしょう？,ファジュル,44444
イスラム教の「サラート」と呼ばれる礼拝のうち、1日の最後に行われる夜の礼拝のことを何というでしょう？,イシャー,4444
化学式はC8H10N4O2である、お茶やコーヒーなどに含まれ覚醒作用を持つアルカロイドの一種は何でしょう？,カフェイン,44444
化学式C8H7N3O2で表され、過酸化水素とともに用いると血液に反応して青白く発光する性質を持つ、警察の科学捜査などに応用される試薬は何でしょう？,ルミノール,44444
古代ギリシャ建築で見られる、女性の姿をかたどった柱のことを何というでしょう？,カリアティード,4444444
スーダンの首都はハルツームですが、南スーダンの首都はどこでしょう？,ジュバ,444
日本語では「環状交差点」という、信号機がなく一方通行で通過するロータリー式の平面交差点のことを英語で何というでしょう？,ラウンドアバウト,44444444
あえて結婚を選ばずに生きてきた女性が、結婚適齢期を迎えて「やっぱり結婚しておけばよかったのではないか」と焦りを感じることを、エッセイスト松原惇子の著作から何症候群というでしょう？,クロワッサン症候群,444444666
2歳未満の幼児に見られる、足の裏をかかとから爪先に向かってこすると、足の親指が反り返り他の指が外側に開く反射のことを、これを発見したフランスの医学者の名前を取って何反射というでしょう？,バビンスキー反射,44444466
チンパンジーなど木の上に棲む霊長類が、両腕で枝を交互につかんで移動する方法のことを、「腕」を意味するラテン語に由来する言葉で何というでしょう？,ブラキエーション,44444444
窓につけるブラインドの細長い羽根板のことを、英語で何というでしょう？,スラット,4444
がま口に付いている玉状の留め金具のことを、ある野菜の名を使って何というでしょう？,らっきょう玉,333336
ゴルフボールの表面にある小さなくぼみのことを、「えくぼ」を意味する英語で何というでしょう？,ディンプル,44444
フランス語で「小さな針」を意味する言葉に由来する、靴ひもの両端に付いているプラスチックや金属の小さな覆いを何というでしょう？,アグレット,44444
コックが被る細長い白い帽子のことを、「白い帽子」を意味するフランス語で何というでしょう？,トック・ブランシュ,444444444
フランス語で「切られた」という意味がある、フランスパンに見られる特徴的な切れ込みのことを何というでしょう？,クープ,444
日本語では「棘座」という、サボテンの棘が生える部分にあり、多くが白い綿毛で覆われている器官をラテン語由来の言葉で何というでしょう？,アレオーレ,44444
鉄道の線路の下に敷いてある砂利のことを、英語由来の言葉で何というでしょう？,バラスト,4444
アニメ『ハクション大魔王』のカンちゃん役や『サザエさん』のフグ田サザエ役、テレビ番組『大改造!!劇的ビフォーアフター』のナレーションなどで知られる声優は誰でしょう？,加藤みどり,66333
格安航空会社を意味する「LCC」とは何という言葉の略でしょう？,ローコストキャリア,444444444
JR品川駅があるのは東京都何区でしょう？,港区,66
アルファベット3文字の「ICAO航空会社コード」のうち、全日本空輸に割り当てられているコードは何でしょう？,ANA,222
JR山手線が乗り入れる駅のうち、五十音順で最初に来るのは何駅でしょう？,秋葉原駅,6666
JR山手線の停車駅の数はいくつでしょう？,29駅,006
日本の市を五十音順に並べた時、最初に来るのは相生市ですが、最後に来るのは何市でしょう？,蕨市,66
ボーイング747の愛称「ジャンボジェット」の由来となった「ジャンボ」はどんな動物でしょう？,ゾウ,44
日本の川で、信濃川に次いで2番目に長い川は何川でしょう？,利根川,666
アルファベット3文字の「IATA空港コード」のうち、関西国際空港に割り当てられているコードは何でしょう？,KIX,222
アルファベット3文字の「IATA空港コード」のうち、大阪国際空港に割り当てられているコードは何でしょう？,ITM,222
示性式C2H5OHで表され、酒類の主成分であることから「酒精」とも呼ばれる物質は何でしょう？,エタノール,44444
アルファベット3文字の「IATA空港コード」のうち、東京国際空港に割り当てられているコードは何でしょう？,HND,222
アルファベット3文字の「ICAO航空会社コード」のうち、日本航空に割り当てられているコードは何でしょう？,JAL,222
アルファベット3文字の「IATA空港コード」のうち、成田国際空港に割り当てられているコードは何でしょう？,NRT,222
富山湾で獲れた寒ブリの輸送路であったことから「鰤街道」、またノーベル賞受賞者に縁があることから「ノーベル街道」との別名がある、愛知県名古屋市と富山県富山市を結ぶ国道は何号でしょう？,国道41号,66006
数学者フィボナッチの出身地であるイタリアの都市で、世界的には「斜塔」の通称を持つ大聖堂の鐘楼が知られているのはどこでしょう？,ピサ,44
漢字では「土瀝青」と表記される、和式便器の緩衝材や道路の舗装に用いられるものは何でしょう？,アスファルト,444444
アメリカのスポーツチームで、NFLのライオンズ、NHLのレッドウィングス、NBAのピストンズ、MLBのタイガースがともに本拠地を置く都市はどこでしょう？,デトロイト,44444
ドイツ語で「乙女」や「処女」といった意味の名前をもつ、1811年にメイヤー兄弟が初登頂に成功したアルプス山脈の山は何でしょう？,ユングフラウ,444444
長野オリンピックの際に作られたものは現在「今井ニュータウン」として活用されている、オリンピック開催にあわせて選手の滞在する場所として提供される施設のことを何というでしょう？,選手村,666
時期はずれで役にたたないもののことを、「夏」と「冬」を使った四字熟語で何というでしょう？,夏炉冬扇,6666
時機遅れで役に立たない物事を指す「六日の菖蒲」とは、何の節句に間に合っていないことを意味しているでしょう？,端午の節句,66366
時機遅れで役に立たない物事を指す「十日の菊」とは、何の節句に間に合っていないことを意味しているでしょう？,重陽の節句,66366
いとこに女優の森光子を持つ、映画『明治天皇と日露大戦争』で俳優として初めて天皇の役を演じた、「アラカン」の愛称で親しまれた俳優は誰でしょう？,嵐寛寿郎,6666
いつまでも見飽きないという意味から「日暮の門」という通称でも知られている、栃木県の日光東照宮の本殿前にある門は何でしょう？,陽明門,666
英語では「parrot somebody's word」などという、話し相手が言うことをそのまま言い返すことを「何返し」というでしょう？,おうむ返し,33363
料理において「小さじ1杯」といえば、通常何ccのことでしょう？,5cc,011
料理において「大さじ1杯」といえば、通常何ccのことでしょう？,15cc,0011
料理において「1カップ」といえば、通常何ccのことでしょう？,200cc,00011
キリスト教において、神の人間に対する無償の愛のことをギリシャ語由来の言葉で何というでしょう？,アガペー,4444
ルネサンスの三大発明といえば、火薬、羅針盤とあと1つは何でしょう？,活版印刷,6666
建国時のカナダの国旗の左上の部分にあったのは、現在のどこの国の国旗でしょう？,イギリス,4444
紀元前6世紀半ばにキュロス2世が建国した、古代ペルシャの王朝を一般に何朝というでしょう？,アケメネス朝,444446
現在のイランのファールス州に位置する、古代ペルシャのダレイオス1世が建設したアケメネス朝の都はどこでしょう？,ペルセポリス,444444
第一次世界大戦の末期に「十四か条の平和原則」を発表するなど、ニューフリーダムと呼ばれる平和主義・進歩主義的な政策を進めたアメリカ第28代大統領は誰でしょう？,ウッドロウ・ウィルソン,44444444444
ドイツ語で「合唱練習書」という意味があり、一般的にはフランツ・ヴュルナーによる『ミュンヘン音楽学校の合唱曲練習書』を指す言葉は何でしょう？,コールユーブンゲン,444444444
浅瀬でも使えるよう底を平たくした小舟のことを指す、森鴎外の有名な短編小説のタイトルにもなっている言葉は何でしょう？,高瀬舟,666
体長がほぼ40インチであることから「ヤード・ロング・ドッグ」の別名を持つ、イギリスのウェールズ原産の犬の種類といえば何でしょう？,ウェルシュコーギー,444444444
1984年に国際アンデルセン賞画家賞を受賞している、代表作に絵本『わが友石頭計算機』『ABCの本』『ふしぎなえ』などがある日本の絵本作家は誰でしょう？,安野光雅,6666
1980年に国際アンデルセン賞画家賞を受賞している日本の絵本作家で、代表作に『ももたろう』や『スーホの白い馬』の挿絵があるのは誰でしょう？,赤羽末吉,6666
1994年に国際アンデルセン賞作家賞を受賞している日本の詩人で、『ふしぎなポケット』『やぎさんゆうびん』『ぞうさん』の作詞で知られるのは誰でしょう？,まど・みちお,334333
気象庁の用語の「風速」とは、何分間の平均風速を指すでしょう？,10分間,0066
天気予報における「瞬間風速」とは、何秒間の風速計測定値の平均でしょう？,3秒間,066
日本では「杉綾」とも呼ばれる、V字型や長方形の模様を縦横に連続させて作られる模様を、「ニシンの骨」という意味の英語で何というでしょう？,ヘリンボーン,444444
特撮番組『ウルトラマン』の怪獣で、「宇宙忍者」といえばバルタン星人ですが、「宇宙恐竜」といえば何でしょう？,ゼットン,4444
多くの登場人物名が『新世紀エヴァンゲリオン』の人物名の元ネタになっている、主人公・鈴原冬二が日本の独裁者となるというストーリーの村上龍による小説は何でしょう？,愛と幻想のファシズム,6366344444
幕末期に安政の大獄と呼ばれる弾圧を行い、桜田門外で水戸浪士らにより暗殺された大老は誰でしょう？,井伊直弼,6666
1964年からサンフランシスコ・ジャイアンツでプレーした、日本人初のメジャーリーガーは誰でしょう？,村上雅則,6666
ボードゲーム「モノポリー」のスタンダード版の舞台としても有名な、ニュージャージー州にあるアメリカ東海岸最大規模のカジノシティはどこでしょう？,アトランティックシティ,44444444444
イタリア・ピエモンテ州発祥で、現地の言葉で「熱いソース」という意味の名を持つ、野菜やパンなどを温かいディップソースに浸して食べる鍋料理は何でしょう？,バーニャカウダ,4444444
カルピスのパッケージに描かれている水玉模様は何を表しているでしょう？,天の川,636
シェイクスピアの悲劇『リア王』で、最後に獄中で殺されてしまうリア王の三女の名前は何でしょう？,コーディリア,444444
「韋編三絶」の由来となった故事で、孔子がヒモが3回も切れるほど読み込んだとされる書物は何でしょう？,易経,66
長年行方不明になっていたが2003年にメキシコで発見され、現在は東京・渋谷駅の連絡通路に設置されている、『太陽の塔』と並んで岡本太郎の代表作として知られる壁画のタイトルは何でしょう？,明日の神話,66366
悪天候時に教会の尖塔や船のマストの先端などに現れる薄青い炎状の光のことを、船乗りの守護聖人の名をとって「何の火」というでしょう？,セントエルモの火,44444436
昔は「勝負事が引き分けになる日」という意味だったが、現在では「友人が冥土に引き寄せられるので葬式を避けるべき日」という解釈が一般的になった、六曜の1つは何でしょう？,友引,66
ヤナギムシ、ババ、メイタ、マコなどの種類があり、日本においては両目が身体の右側についている魚として一般に認識されていることから「左ヒラメ」に対して呼ばれることが多い魚といえば何でしょう？,カレイ,444
パンテノール、エルゴステロール、ベータカロテンなどのように、人間の体内に入るとビタミンに変化する物質を総称して何というでしょう？,プロビタミン,444444
大阪、兵庫、和歌山、岡山、広島、山口、徳島、香川、愛媛、福岡、大分の1府10県に跨る国立公園は何でしょう？,瀬戸内海国立公園,66666666
『貨幣改革論』や『雇用・利子および貨幣の一般理論』などを著し、有効需要の原理を説いてマクロ経済学を確立させた、近代経済学を代表するイギリスの経済学者は誰でしょう？,ジョン・メイナード・ケインズ,44444444444444
将棋の一般的な対局で自陣に並べられる20枚の駒のうち、初手で動かすことができない駒は何枚あるでしょう？,3枚,06
2人で向かい合って話すことを「対談」といいますが、3人で向かい合って話すことを何というでしょう？,鼎談,66
そのコンビ名は2人が浪人時代に通っていた河合塾のあるシステム名に由来する、ボケの徳井義実とツッコミの福田充徳からなるお笑いコンビは何でしょう？,チュートリアル,4444444
「自然と健康を科学する」をコーポレート・スローガンとする、入浴剤の「バスハーブ」や漢方薬などを販売している医薬品メーカーは何でしょう？,ツムラ,444
「あったらいいなをカタチにする」をコーポレート・スローガンとする、主な製品に「トイレ洗浄中」「タフデント」「ブルーレット」などがある医薬品メーカーは何でしょう？,小林製薬,6666
日本のテーマパークで、博物館明治村は愛知県にありますが、日本大正村はどこの都道府県にあるでしょう？,岐阜県,666
1600年の関ヶ原の戦いでは西軍の総大将を務めた、豊臣政権の五大老の1人は誰でしょう？,毛利輝元,6666
北欧神話に登場し、日本語では「世界樹」などと呼ばれる、天地を貫いて世界全体を成している巨大な樹木を何というでしょう？,ユグドラシル,444444
著書に『超大国日本の挑戦』などがあり、キューブリック監督の映画『博士の異常な愛情』の主人公のモデルになったことでも知られる、アメリカの未来学者は誰でしょう？,ハーマン・カーン,44444444
本名を竹中尚人という、『逆光線』『NAVY BLUE』『気絶するほど悩ましい』などの曲で知られる日本のミュージシャンは誰でしょう？,Char,2111
